,Title,Text,Source,URL,Label
24,"Biografi BJ Habibie, Presiden ke-3 yang Dijuluki Bapak Teknologi Indonesia","Karier politik Bacharuddin Jusuf (BJ) Habibie dimulai ketika ia kembali ke Indonesia pada 1974 atas perintah Presiden Soeharto. Pada saat itu, Habibie telah memiliki reputasi sebagai ilmuwan terkemuka di bidang teknologi penerbangan, dengan pengalaman bekerja di luar negeri. Di bawah pemerintahan Soeharto, BJ Habibie diangkat menjadi Menteri Negara Riset dan Teknologi pada 1978, sebuah posisi yang ia emban selama dua dekade hingga Maret 1998. Selain menjadi menteri, ia juga dipercaya untuk memimpin sejumlah perusahaan BUMN dalam sektor industri strategis selama 10 tahun, yang memperkuat peran pentingnya dalam pembangunan teknologi dan industri di Indonesia.

Kiprah politik Habibie terus berlanjut ketika pada 14 Maret 1998, ia diangkat menjadi Wakil Presiden Republik Indonesia ke-7 mendampingi Soeharto dalam Kabinet Pembangunan VII. Namun, masa jabatannya sebagai wakil presiden terbilang sangat singkat, hanya berlangsung hingga 21 Mei 1998, ketika Soeharto mengundurkan diri dari jabatannya di tengah gelombang besar reformasi. Setelah pengunduran diri Soeharto, Habibie secara otomatis diangkat sebagai Presiden Indonesia ke-3 pada usia 62 tahun. Meskipun masa kepemimpinannya relatif singkat, hanya dari 21 Mei 1998 hingga 20 Oktober 1999, ia mewarisi negara dalam kondisi ekonomi dan sosial yang sedang mengalami krisis besar.

Selama masa pemerintahannya, BJ Habibie menghadapi tantangan besar, termasuk kehilangan wilayah Timor Timur dari pangkuan Negara Kesatuan Republik Indonesia. Pada 30 Agustus 1999, Habibie menginisiasi jajak pendapat di Timor Timur, memberikan rakyat di sana pilihan untuk tetap menjadi bagian dari Indonesia atau merdeka. Keputusan ini memicu kontroversi di kalangan politisi dan pengamat Indonesia, namun Habibie berhasil menyelesaikan masalah ini dengan damai, meskipun hasilnya adalah kemerdekaan bagi Timor Timur. Meskipun begitu, langkah-langkah yang diambil Habibie untuk memulihkan stabilitas Indonesia selama masa pemerintahannya yang singkat sangatlah signifikan, terutama di tengah krisis ekonomi dan disintegrasi bangsa yang parah.

BJ Habibie tetap dikenang sebagai pemimpin yang berjasa dalam menstabilkan ekonomi Indonesia setelah masa kelam kerusuhan Mei 1998. Ia segera membentuk kabinet baru yang fokus pada pemulihan ekonomi, termasuk mengamankan kembali dukungan dana dari Dana Moneter Internasional (IMF) dan komunitas donor internasional. Habibie juga membuat kebijakan yang membuka ruang lebih luas bagi kebebasan berpendapat dan kebebasan politik. Beberapa undang-undang penting yang disahkan selama masa pemerintahannya antara lain UU tentang Otonomi Daerah dan UU Anti Monopoli, yang menjadi fondasi penting bagi reformasi ekonomi dan politik di Indonesia. Setelah masa jabatannya berakhir, meskipun Habibie sempat dipaksa lengser akibat pertanggungjawabannya atas lepasnya Timor Timur tidak diterima, kontribusinya dalam membawa Indonesia keluar dari krisis tetap diakui.",https://www.liputan6.com,https://www.liputan6.com/hot/read/5712885/biografi-bj-habibie-presiden-ke-3-yang-dijuluki-bapak-teknologi-indonesia,Liga Spanyol
0,Timnas Putri Indonesia Berkolaborasi dengan Unesa untuk Mengembangkan Ilmu Olahraga,"Bola.com, Surabaya - PSSI berkomitmen untuk memajukan sepak bola wanita di Indonesia. Mereka telah menjalin kemitraan dengan Universitas Negeri Surabaya (Unesa) dan Forum Dekan Fakultas Ilmu Keolahragaan dan Kesehatan. Kolaborasi ini bertujuan untuk menerapkan ilmu olahraga (Sport Science) pada Timnas Indonesia Putri. Melalui kerja sama strategis ini, PSSI berharap dapat meningkatkan kualitas timnas wanita di berbagai kompetisi.

Kerja sama ini akan menjadi proyek percontohan untuk kegiatan Timnas Putri pada tahun 2025. Pada tahun tersebut, Timnas Indonesia Putri dijadwalkan mengikuti berbagai agenda internasional seperti ASEAN Women's Championship 2025, kualifikasi Piala AFC, serta uji coba internasional lainnya. Dengan persiapan yang matang, diharapkan timnas dapat meraih prestasi gemilang di ajang internasional.

Acara penandatanganan perjanjian kerja sama tersebut dihadiri oleh perwakilan dari PSSI, KONI, dan Unesa. Acara berlangsung di Gedung Rektorat Kampus 2 Unesa, Lidah Wetan, Surabaya, pada hari Kamis, 16 Januari 2025. Partisipasi berbagai pihak dalam acara ini menunjukkan dukungan penuh terhadap pengembangan sepak bola wanita di Indonesia.

Advertisement

Vivin Cahyani Sungkono, anggota Komite Eksekutif PSSI, menyatakan apresiasinya atas kerja sama ini. Ia menekankan pentingnya dukungan dari Unesa dan Forum Dekan Fakultas Ilmu Keolahragaan dan Kesehatan untuk membangun sepak bola wanita dan olahraga di Indonesia. ""PSSI berterima kasih kepada Unesa, KONI Pusat, KONI Jatim yang hadir langsung untuk memonitor Program kerjasama ini dan tentunya stimulus ini akan diikuti oleh Fakultas Ilmu Keolahragaan dan Kesehatan secara nasional atas kerja sama ini yang akan memberikan dampak positif pengembangan sepak bola wanita di Indonesia dan juga cabang olahraga lain,"" ungkap Vivin.",https://www.liputan6.com,https://www.liputan6.com/hot/read/5881138/ac-milan-menghadapi-dilema-transfer-januari-marcus-rashford-atau-kyle-walker-yang-akan-dipilih,Liga Italia
1,"Prediksi Final Supercoppa Italiana, Inter Milan lawan AC Milan: Derbi Sengit di Riyadh","Bola.com, Riyadh - Derby Della Madonnina yang penuh tensi akan memeriahkan final Supercoppa Italiana pada musim ini. Uniknya, pertandingan tersebut tidak akan berlangsung di Milan, meskipun kedua tim berasal dari kota tersebut.

Laga final Supercoppa Italiana yang mempertemukan Inter Milan dan AC Milan ini akan diadakan di Al-Awwal Park, Riyadh, Arab Saudi, pada Selasa (7/1/2025) dini hari WIB. Pertandingan ini diharapkan akan menarik perhatian banyak penggemar sepak bola dari seluruh dunia.

Inter Milan berhasil mencapai final Supercoppa Italiana setelah mengalahkan Atalanta dengan skor 2-0 di babak semifinal. Denzel Dumfries menjadi bintang bagi Inter dalam pertandingan tersebut dengan mencetak dua gol penting. ""Denzel Dumfries menjadi pahlawan Inter saat itu dengan memborong dua gol,"" kata seorang pengamat sepak bola.

Advertisement

Di sisi lain, AC Milan menampilkan performa yang cukup baik di babak semifinal. Christian Pulisic dan rekan-rekannya berhasil mengamankan kemenangan 2-1 melawan Juventus. Penampilan solid mereka membuat para pendukung AC Milan optimis menghadapi final mendatang.",https://www.liputan6.com,https://www.liputan6.com/hot/read/5881138/ac-milan-menghadapi-dilema-transfer-januari-marcus-rashford-atau-kyle-walker-yang-akan-dipilih,Liga Italia
2,"Theo Hernandez Berhasil Mencetak 30 Gol untuk AC Milan, Melampaui Rekor Paolo Maldini","Theo Hernandez kini tercatat sebagai bek dengan jumlah gol terbanyak sepanjang sejarah AC Milan. Pemain asal Prancis ini berhasil mencetak 30 gol untuk Rossoneri, mengungguli rekor yang sebelumnya dipegang oleh legenda hidup, Paolo Maldini.

Theo tampil sejak awal pertandingan ketika AC Milan bertandang ke markas Como pada pertandingan pekan ke-19 Serie A, yang berlangsung Rabu (15/1) dini hari WIB. Dalam pertandingan tersebut, Milan berhasil meraih kemenangan dengan skor akhir 2-1.

Milan sempat tertinggal lebih dulu pada menit ke-60, ketika Assane Diao berhasil menjebol gawang Mike Maignan. Namun demikian, Milan mampu membalikkan keadaan berkat gol dari Theo pada menit ke-71 dan Rafael Leao yang mencetak gol tambahan pada menit ke-76.

Advertisement

Bagi Theo, gol yang dicetak ke gawang Como memiliki makna yang sangat penting. Bukan hanya soal mendapatkan tiga poin, tetapi juga tentang pencapaian rekor luar biasa yang ditorehkan oleh bek kiri ini. Untuk lebih lengkapnya, simak ulasannya di bawah ini ya.",https://www.liputan6.com,https://www.liputan6.com/hot/read/5881138/ac-milan-menghadapi-dilema-transfer-januari-marcus-rashford-atau-kyle-walker-yang-akan-dipilih,Liga Italia
3,"Kakak yang Juga Agen Rashford Berada di Milan untuk Negosiasi awal dengan Rossoneri, Membuka Peluang Keluar dari MU","Bola.com, Jakarta - Dane Rashford, yang merupakan saudara sekaligus manajer dari bintang MU, Marcus Rashford, dilaporkan berada di Milan minggu ini. Kehadirannya di sana telah memicu berbagai spekulasi terkait masa depan karier Marcus Rashford di dunia sepak bola.

Menurut laporan terbaru dari pakar transfer Matteo Moretto, Dane, yang turut mendirikan DN May Sports Management bersama saudara mereka Dwaine Maynard, sedang melakukan kunjungan yang menimbulkan rumor mengenai kemungkinan transfer. DN May Sports Management dikenal sebagai agen yang mewakili Marcus Rashford sebagai klien utama mereka, sehingga setiap langkah mereka selalu diawasi dengan cermat oleh media.

Kehadiran Dane di Milan semakin memperkuat spekulasi bahwa Marcus Rashford, yang merupakan lulusan akademi MU, mungkin sedang mempertimbangkan kepindahan ke AC Milan. Hal ini menjadi perhatian utama bagi para penggemar dan analis sepak bola yang mengikuti perkembangan karier pemain tersebut.

Advertisement

Secara khusus, jurnalis dan pakar transfer lainnya, Fabrizio Romano, mengutip sumber dari The Athletic menyatakan bahwa pembicaraan dengan AC Milan akan dimulai besok. Klub-klub Italia tertarik untuk mengetahui persyaratan peminjaman Rashford. ""Ini baru permulaan karena mereka (perwakilan Marcus Rashford) juga akan berbicara dengan Borussia Dortmund dalam beberapa hari mendatang... dan klub-klub lain juga,"" kata Romano.",https://www.liputan6.com,https://www.liputan6.com/hot/read/5881138/ac-milan-menghadapi-dilema-transfer-januari-marcus-rashford-atau-kyle-walker-yang-akan-dipilih,Liga Italia
4,Foto Liga Italia Hari Ini - Foto Terbaru Terkini,,https://www.liputan6.com,https://www.liputan6.com/hot/read/5881138/ac-milan-menghadapi-dilema-transfer-januari-marcus-rashford-atau-kyle-walker-yang-akan-dipilih,Liga Italia
5,"Profil Putri Ariani, Penyanyi Berbakat yang Disebut Cucu Habibie","Liputan6.com, Jakarta Putri Ariani, penyanyi muda berbakat asal Indonesia, kembali mencetak sejarah dengan merilis album debutnya di Amerika Serikat yang bertajuk Evolve. Album Evolve berisi 15 lagu, sebagian besar ditulis dalam bahasa Inggris untuk memperluas daya tariknya secara global. Putri menjadikan lagu ""Crown"" sebagai single utama. Album ini menjadi langkah besar dalam karier Putri untuk memperkenalkan karyanya ke panggung musik internasional.

Putri Ariani tak hanya dikenal karena suaranya yang memukau. Kehidupan pribadinya pun juga menjadi sorotan, termasuk soal silsilah keluarganya yang dikaitkan dengan tokoh besar Indonesia. Rumor yang beredar menyebutkan bahwa finalis America's Got Talent (AGT) 2023 ini merupakan keturunan langsung dari mantan Presiden RI ke-3, BJ Habibie. Selain itu, ada pula kabar yang mengaitkannya dengan garis keturunan Raja Mataram Kuno.

Namun, bagaimana fakta sebenarnya? Dilansir dari berbagai sumber, berikut adalah ulasan lengkap tentang Profil Putri Ariani.",https://www.liputan6.com,https://www.liputan6.com/hot/read/5881138/ac-milan-menghadapi-dilema-transfer-januari-marcus-rashford-atau-kyle-walker-yang-akan-dipilih,Liga Italia
6,Sergio Conceicao Sebut Skuad AC Milan sebagai Tim yang Rendah Hati,"Pada hari Senin (30/12/2024) kemarin, Sergio Conceicao resmi diumumkan sebagai pelatih baru AC Milan. Setelah pengumuman tersebut, ia segera mengambil alih kendali tim Rossoneri untuk mempersiapkan pertandingan melawan Juventus yang akan datang.

Beberapa hari setelah kedatangannya di Milan, Conceicao diminta pendapatnya mengenai skuad Rossoneri yang ada saat ini. Ia memberikan apresiasi kepada Theo Hernandez dan rekan-rekannya dalam tim.

""Saya menemukan tim yang rendah hati, yang ingin belajar, yang ingin memahami apa yang diinginkan pelatih mereka saat ini. Dan ini adalah dasar untuk bekerja dengan kualitas,"" ujarnya seperti dilaporkan oleh MilanNews.

Conceicao menekankan bahwa sikap rendah hati dan keinginan untuk belajar dari para pemain adalah fondasi penting untuk membangun tim yang berkualitas. Dengan semangat yang ditunjukkan oleh skuad, ia optimis dapat membawa AC Milan menuju prestasi yang lebih baik di masa mendatang.

Selain itu, ia juga menyoroti pentingnya komunikasi yang efektif antara pelatih dan pemain untuk mencapai tujuan bersama.",https://www.liputan6.com,https://www.liputan6.com/hot/read/5881138/ac-milan-menghadapi-dilema-transfer-januari-marcus-rashford-atau-kyle-walker-yang-akan-dipilih,Liga Italia
7,"Man City Tawar Andrea Cambiaso Rp1 Triliun, Akankah Juventus Menjualnya?","Bola.com, Jakarta - Manchester City dikabarkan berencana mengajukan tawaran resmi kepada Juventus untuk mendapatkan Andrea Cambiaso dalam 48 jam mendatang. Nilai transfer yang diajukan diperkirakan mencapai sekitar 65 juta euro atau setara dengan Rp1 triliun. Informasi ini berasal dari laporan pakar transfer Sky Sport Italia, Gianluca Di Marzio, dan Fabrizio Romano.

Diskusi antara kedua klub diperkirakan akan meningkat dalam beberapa hari ke depan, dengan pengajuan proposal resmi yang diprediksi akan terjadi pada akhir pekan ini. Namun, Juventus bersikeras untuk tidak melepas pemain full-back mereka di pertengahan musim. Klub asal Turin tersebut lebih memilih untuk menunda transaksi hingga bursa transfer musim panas pada bulan Juli.

Meskipun demikian, jika tawaran dari Manchester City mendekati angka yang diinginkan, yaitu sekitar 70-80 juta euro, Juventus mungkin akan mempertimbangkan untuk membuka peluang penjualan. ""Namun, Juventus berkeras untuk tidak menjual full-back mereka di tengah musim,"" demikian kutipan dari laporan tersebut. Situasi ini menunjukkan bahwa meskipun ada ketertarikan yang kuat, keputusan akhir masih bergantung pada negosiasi yang lebih lanjut.",https://www.liputan6.com,https://www.liputan6.com/hot/read/5881138/ac-milan-menghadapi-dilema-transfer-januari-marcus-rashford-atau-kyle-walker-yang-akan-dipilih,Liga Italia
8,"Lanjutan Serie A, Como Kalah 1-2 dari AC Milan","Pertandingan dimulai dengan intensitas tinggi sejak peluit pertama dibunyikan. Kedua tim memiliki beberapa kesempatan untuk mencetak gol. Namun, hingga babak pertama berakhir, tidak ada gol yang berhasil diciptakan oleh kedua belah pihak.

Ketika babak kedua dimulai, Como akhirnya berhasil memecahkan kebuntuan pada menit ke-60. Berawal dari akselerasi memotong ke dalam dari sisi kanan, Diao berhasil menjebol gawang yang dijaga oleh Mike Maignan.

Meskipun tertinggal, Milan tidak menyerah begitu saja. Tim tamu berhasil menyamakan skor pada menit ke-71. Gol ini bermula dari situasi bola mati sepak pojok, di mana Hernandez melepaskan tembakan voli yang sukses menggetarkan jala gawang lawan.

Selang lima menit kemudian, Milan berhasil membalikkan keadaan berkat aksi Leao. Mendapatkan umpan terobosan cerdas dari Tammy Abraham, Leao dengan pintar melakukan chip untuk menaklukkan Jean Butez.

Como berusaha mengejar ketertinggalan di sisa waktu pertandingan. Namun sayangnya, usaha mereka tidak membuahkan hasil. Pertandingan berakhir dengan skor 2-1 untuk kemenangan Milan.",https://www.liputan6.com,https://www.liputan6.com/hot/read/5881138/ac-milan-menghadapi-dilema-transfer-januari-marcus-rashford-atau-kyle-walker-yang-akan-dipilih,Liga Italia
9,"Como Mendadak Bersaing dengan AC Milan untuk Merekrut Rashford, Varane Kemungkinan Jadi Kunci Keputusan","Pemain Manchester United, Marcus Rashford (tengah), merayakan golnya ke gawang Tottenham Hotspur pada laga lanjutan Liga Inggris 2023/2024 di Old Trafford, Manchester, Inggris, Senin (15/01/2024) dini hari WIB. (AP Photo/Dave Thompson) - Bola.com

Bola.com, Jakarta - AC Milan kini harus bersaing dengan pihak yang tidak terduga, yaitu Como, dalam usaha mereka untuk merekrut Marcus Rashford, pemain Manchester United yang dikabarkan ingin meninggalkan Old Trafford.

Pemain berusia 27 tahun ini belakangan ini sering dikaitkan dengan kepindahan ke Serie A, di mana Rossoneri dianggap sebagai klub yang paling berminat. Namun, laporan terbaru menunjukkan bahwa Rashford juga menjadi incaran klub yang dipimpin oleh Cesc Fabregas, yaitu Como.

Menurut jurnalis Gianluca Di Marzio, Como secara mengejutkan bergabung dalam persaingan untuk memperoleh Rashford.

Advertisement

Como dikabarkan tidak menghadapi masalah dalam memenuhi tuntutan ekonomi penyerang tersebut, yang bisa menjadi keuntungan signifikan karena MU tidak bersedia membayar sebagian gaji Rashford jika transfernya berupa kesepakatan pinjaman.",https://www.liputan6.com,https://www.liputan6.com/hot/read/5881138/ac-milan-menghadapi-dilema-transfer-januari-marcus-rashford-atau-kyle-walker-yang-akan-dipilih,Liga Italia
10,Artikel Liga Italia Hari Ini - Artikel Terbaru Terkini,"Pada pertandingan giornata 19 Serie A Liga Italia yang berlangsung Rabu (15/1/2025) dini hari WIB, AC Milan meraih kemenangan di markas Como 1907, sedangkan Juventus bermain imbang di kandang Atalanta.",https://www.liputan6.com,https://www.liputan6.com/hot/read/5881138/ac-milan-menghadapi-dilema-transfer-januari-marcus-rashford-atau-kyle-walker-yang-akan-dipilih,Liga Italia
11,Sergio Conceicao Terapkan Aturan Ketat untuk Ubah Kebiasaan Pemain Milan,"Pelatih AC Milan asal Portugal, Sergio Conceicao, bereaksi selama pertandingan semifinal Supercoppa Italiana antara Juventus dan AC Milan di Taman Al-Awwal di Riyadh, Sabtu dini hari WIB (4-1-2025). (Fayez NURELDINE/AFP) - Bola.com

Bola.com, Jakarta - Sergio Conceicao saat ini sedang menginisiasi perubahan signifikan di Milan dengan menerapkan peraturan yang lebih ketat serta rutinitas baru untuk para pemainnya. Langkah ini mencerminkan tekadnya dalam membangun disiplin dan meningkatkan kinerja tim sejak dia menggantikan Paulo Fonseca sebagai pelatih Milan dua minggu yang lalu.

Conceicao telah memberikan efek langsung dengan memenangkan dua pertandingan pertamanya melawan Juventus dan Inter Milan, sekaligus membawa Milan memenangkan trofi Supercoppa Italiana di Riyadh. ""Setelah kembali ke Milanello, Conceicao langsung bergerak cepat untuk mengimplementasikan pendekatan baru yang lebih tegas,"" berbeda dengan metode yang lebih santai dari dua pelatih Milan sebelumnya, Stefano Pioli dan Fonseca.

Dengan langkah-langkah ini, Conceicao berusaha untuk menciptakan lingkungan yang lebih disiplin dan kompetitif di dalam tim. Pendekatan tegas ini diharapkan dapat memberikan hasil positif dalam jangka panjang bagi Milan, terutama dalam menghadapi kompetisi yang semakin ketat di liga. Transformasi yang dilakukan Conceicao menunjukkan bahwa dia berkomitmen untuk membawa Milan ke level yang lebih tinggi, baik dari segi performa maupun mentalitas tim.",https://www.liputan6.com,https://www.liputan6.com/hot/read/5881138/ac-milan-menghadapi-dilema-transfer-januari-marcus-rashford-atau-kyle-walker-yang-akan-dipilih,Liga Italia
12,"Noah Okafor, Pemain yang Sering Duduk di Bangku Cadangan AC Milan Kemungkinan Akan Pindah ke Klub Jerman","Terdapat kabar terbaru mengenai Noah Okafor. Pemain depan AC Milan tersebut dikabarkan akan hijrah ke Jerman pada bursa transfer musim dingin ini.

Okafor baru saja memulai musim keduanya bersama AC Milan. Ia bergabung dengan klub tersebut setelah direkrut dari RB Salzburg pada tahun 2023 lalu.

Namun, pada musim keduanya di Rossoneri, Okafor lebih sering menjadi penghangat bangku cadangan di Milan. Ia lebih sering tampil sebagai pemain pengganti dalam tim Rossoneri.

Advertisement

Menurut laporan dari Fabrizio Romano, Okafor mulai merasa tidak nyaman dengan situasi ini. Ia dikabarkan akan pindah ke Jerman pada musim dingin ini.

Simak informasi selengkapnya di bawah ini.",https://www.liputan6.com,https://www.liputan6.com/hot/read/5881138/ac-milan-menghadapi-dilema-transfer-januari-marcus-rashford-atau-kyle-walker-yang-akan-dipilih,Liga Italia
13,"AC Milan Berhasil Raih 3 Poin, Sementara Juventus Hanya Bermain Imbang saat Bertandang ke Markas Atalanta","Bola.com, Jakarta - Dalam pertandingan giornata 19 Serie A Liga Italia yang berlangsung pada Rabu (15/1/2025) dini hari WIB, AC Milan dan Juventus meraih hasil yang berbeda. AC Milan berhasil membawa pulang kemenangan penuh dari markas Como 1907, sedangkan Juventus harus puas dengan hasil imbang saat bertandang ke markas Atalanta.

Menghadapi Como 1907 di Stadio Giuseppe Sinigaglia, AC Milan sempat tertinggal lebih dahulu. Assane Diao mencetak gol untuk Como pada menit ke-60 setelah menerima umpan dari Maxence Caqueret, membuat tim tuan rumah unggul sementara.

Namun, AC Milan tidak tinggal diam dan segera bangkit. Mereka berhasil membalas dengan dua gol dalam rentang waktu lima menit yang menentukan hasil akhir pertandingan.

Advertisement

Gol penyama kedudukan dicetak oleh Theo Hernandez pada menit ke-71, dan kemudian Rafael Leao memastikan kemenangan Rossoneri dengan golnya lima menit kemudian. ""Dua gol tersebut cukup untuk membawa AC Milan pulang dengan membawa tiga poin penuh.""

Kemenangan ini membawa AC Milan naik ke posisi ketujuh klasemen dengan total 31 poin dari 19 pertandingan di Serie A Liga Italia musim ini. Hasil ini tentunya memberikan dorongan moral bagi Rossoneri untuk menghadapi laga-laga berikutnya.",https://www.liputan6.com,https://www.liputan6.com/hot/read/5881138/ac-milan-menghadapi-dilema-transfer-januari-marcus-rashford-atau-kyle-walker-yang-akan-dipilih,Liga Italia
14,Video Liga Italia Hari Ini - Video Terbaru Terkini,,https://www.liputan6.com,https://www.liputan6.com/hot/read/5881138/ac-milan-menghadapi-dilema-transfer-januari-marcus-rashford-atau-kyle-walker-yang-akan-dipilih,Liga Italia
15,Jay Idzes Berbagi Pengalaman Menghadapi Penyerang Hebat Serie A: Sangat Menggembirakan,"Venezia saat ini belum menunjukkan performa tim yang maksimal. Mereka masih berada di posisi bawah dalam klasemen. Namun, dari segi individu, Jay Idzes merasa tertantang karena harus menghadapi lawan dengan level yang sangat tinggi.

""Semua tim di Serie A memiliki pemain yang sangat kuat. Setiap minggu saya harus menghadapi pemain-pemain hebat, dan bagi saya itu adalah tantangan,"" ujar Jay Idzes dinukil dari media Italia, Triveneto Goal. Hal ini menunjukkan bahwa meskipun tim belum mencapai performa yang diinginkan, Jay tetap berusaha untuk memberikan yang terbaik dalam setiap pertandingan.

Jay menyebutkan, ""Kali ini saya menghadapi pemain seperti Lautaro Martinez, Mehdi Taremi, Marcus Thuram, dan Marko Arnautovic."" Bertemu dengan pemain-pemain tersebut memberikan pengalaman berharga bagi Jay, yang selalu berusaha untuk menikmati setiap pertandingan.

Ia menambahkan, ""Sangat menyenangkan bisa bertanding dengan pemain seperti mereka, dan saya mencoba menikmatinya sambil memberikan yang terbaik,"" jelas palang pintu kelahiran Mierlo, Belanda, pada 2 Juni 2000, itu. Dengan semangat dan tekad yang kuat, Jay Idzes berkomitmen untuk terus meningkatkan kemampuannya di setiap kesempatan yang ada.",https://www.liputan6.com,https://www.liputan6.com/hot/read/5881138/ac-milan-menghadapi-dilema-transfer-januari-marcus-rashford-atau-kyle-walker-yang-akan-dipilih,Liga Italia
16,Menarik! Ini Prediksi Starting XI Milan Jika Marcus Rashford Bergabung,"Winger Manchester United, Marcus Rashford, gagal mencetak gol saat timnya takluk 6-7 (1-1) dari Manchester City lewat drama adu penalti pada Community Shield 2024 di Stadion Wembley, Sabtu (10/8/2024) malam WIB. (AP Photo/David Cliff) - Bola.com

Sepanjang perjalanan kariernya, posisi paling ideal bagi Rashford di lapangan sering menjadi topik perdebatan. Ia kerap dimainkan sebagai sayap kiri, penyerang utama, atau kadang-kadang sebagai penyerang kedua, seperti ketika memperkuat Timnas Inggris pada Piala Dunia 2018.

""Ia biasanya bermain sebagai sayap kiri, penyerang tengah, atau sesekali sebagai penyerang kedua,"" demikian kutipan dari sumber aslinya.

Dalam konteks ini, fleksibilitas Rashford dalam bermain di berbagai posisi menunjukkan kemampuannya untuk beradaptasi dengan strategi tim yang berbeda. Namun, hal ini juga menimbulkan pertanyaan tentang di mana ia paling efektif dan dapat memberikan kontribusi maksimal bagi tim yang dibelanya.

Di sisi lain, posisi sayap kiri di AC Milan telah menjadi area yang stabil berkat kehadiran Rafael Leao. Pemain asal Portugal ini adalah sosok kunci bagi Rossoneri di posisi tersebut dan, ketika tampil dalam kondisi terbaiknya, sulit untuk digantikan.

""Posisi sayap kiri di Milan sudah menjadi area yang mapan dengan keberadaan Rafael Leao,"" sebagaimana dinyatakan dalam sumber aslinya.

Situasi ini membuat persaingan semakin ketat bagi Rashford jika ia memilih untuk bergabung dengan Milan, mengingat Leao telah menancapkan pengaruh yang kuat di tim tersebut.

Rashford bisa menjadi pilihan rotasi yang sangat baik, namun dengan mempertimbangkan gajinya yang tinggi, sulit untuk membayangkan bahwa ia akan menerima peran sebagai pemain pengganti di Milan.

""Rashford dapat menjadi opsi rotasi yang sangat baik, tetapi mempertimbangkan gajinya yang tinggi,"" sebagaimana disebutkan dalam kutipan sumber.

Kondisi ini menimbulkan tantangan bagi klub yang ingin merekrutnya, karena harus menyeimbangkan antara kontribusi potensial Rashford dan implikasi finansial dari gajinya. Oleh karena itu, keputusan untuk mendatangkan Rashford tidak hanya akan didasarkan pada kebutuhan taktis, tetapi juga pertimbangan ekonomi yang matang.",https://www.liputan6.com,https://www.liputan6.com/hot/read/5881138/ac-milan-menghadapi-dilema-transfer-januari-marcus-rashford-atau-kyle-walker-yang-akan-dipilih,Liga Italia
